{"schema":"lockwood.cleanup-lease/v1","target_digest":"sha256:aaaaaaaaaaaaaaaaaaaaaaaaaaaaaaaaaaaaaaaaaaaaaaaaaaaaaaaaaaaaaaaa","cleanup_plan_digest":"sha256:bbbbbbbbbbbbbbbbbbbbbbbbbbbbbbbbbbbbbbbbbbbbbbbbbbbbbbbbbbbbbbbb","coordinator":"coordinator.example","lease_id":"lease:cleanup-0001","fencing_token":"fence:0001","acquired_at":"2026-09-17T12:29:00Z","expires_at":"2026-09-17T13:00:00Z","state":"valid","blockers":[]}
